{
  "schemaVersion": "cairnmap.class.v1",
  "projectId": "openriamap-ria",
  "runtimeStatus": "active",
  "classCode": "TRP",
  "classKey": "tradePoint",
  "sourceFeatureKey": "交易点",
  "label": {
    "zh-CN": "交易点",
    "en": "Trade Point"
  },
  "description": "交易点 class config-primary config. Runtime facade now resolves from preset Class config.",
  "data": {
    "typeField": "Type",
    "classField": "Class",
    "worldField": "World",
    "defaultType": "Points",
    "defaultClass": "TRP"
  },
  "geometry": {
    "type": "Point",
    "sourceField": "coordinate",
    "axisOrder": "x,y,z",
    "required": true
  },
  "identity": {
    "idField": "ID",
    "nameField": "Name",
    "displayNameField": "Name"
  },
  "classification": {
    "kindField": "Kind",
    "skindField": "SKind",
    "skind2Field": "SKind2",
    "required": false,
    "options": [
      {
        "kind": "NOM",
        "skind": "NOM",
        "skind2": "",
        "drawMode": "point",
        "geom": "点",
        "label": {
          "zh-CN": "默认"
        },
        "workflow": {
          "visible": true
        },
        "display": {
          "ruleId": null
        }
      },
      {
        "kind": "SPE",
        "skind": "SPE",
        "skind2": "",
        "drawMode": "point",
        "geom": "点",
        "label": {
          "zh-CN": "特殊"
        },
        "workflow": {
          "visible": true
        },
        "display": {
          "ruleId": null
        }
      }
    ]
  },
  "fields": [
    {
      "key": "ID",
      "label": {
        "zh-CN": "交易点ID"
      },
      "type": "text",
      "required": true,
      "optional": false,
      "sourceRuntimeField": "ID",
      "scenes": {
        "workflow": true,
        "editor": true,
        "infocard": true,
        "search": true
      }
    },
    {
      "key": "Name",
      "label": {
        "zh-CN": "交易点名"
      },
      "type": "text",
      "required": true,
      "optional": false,
      "sourceRuntimeField": "Name",
      "scenes": {
        "workflow": true,
        "editor": true,
        "infocard": true,
        "search": true
      }
    },
    {
      "key": "Kind",
      "label": {
        "zh-CN": "类型(Kind)"
      },
      "type": "text",
      "required": true,
      "optional": false,
      "sourceRuntimeField": "Kind",
      "scenes": {
        "workflow": true,
        "editor": true,
        "infocard": true,
        "search": false
      }
    },
    {
      "key": "SKind",
      "label": {
        "zh-CN": "子类型(SKind)"
      },
      "type": "text",
      "required": false,
      "optional": true,
      "sourceRuntimeField": "SKind",
      "scenes": {
        "workflow": true,
        "editor": true,
        "infocard": true,
        "search": false
      }
    },
    {
      "key": "SKind2",
      "label": {
        "zh-CN": "三级子类型(SKind2)"
      },
      "type": "text",
      "required": false,
      "optional": true,
      "sourceRuntimeField": "SKind2",
      "scenes": {
        "workflow": true,
        "editor": true,
        "infocard": true,
        "search": false
      }
    },
    {
      "key": "Interaction",
      "label": {
        "zh-CN": "交互模式(Interaction)"
      },
      "type": "text",
      "required": false,
      "optional": true,
      "sourceRuntimeField": "Interaction",
      "scenes": {
        "workflow": true,
        "editor": true,
        "infocard": true,
        "search": false
      }
    },
    {
      "key": "Situation",
      "label": {
        "zh-CN": "启用状况(Situation)"
      },
      "type": "text",
      "required": false,
      "optional": true,
      "sourceRuntimeField": "Situation",
      "scenes": {
        "workflow": true,
        "editor": true,
        "infocard": true,
        "search": false
      }
    },
    {
      "key": "TradeJSON",
      "label": {
        "zh-CN": "交易列表(Trade) JSON"
      },
      "type": "text",
      "required": false,
      "optional": true,
      "sourceRuntimeField": "TradeJSON",
      "scenes": {
        "workflow": true,
        "editor": true,
        "infocard": true,
        "search": false
      }
    },
    {
      "key": "elevation",
      "label": {
        "zh-CN": "高度(y)"
      },
      "type": "number",
      "required": false,
      "optional": true,
      "sourceRuntimeField": "elevation",
      "scenes": {
        "workflow": true,
        "editor": true,
        "infocard": true,
        "search": false
      }
    }
  ],
  "groups": [
    {
      "key": "tags",
      "label": {
        "zh-CN": "tags（可选：用于筛选/渲染差分）"
      },
      "type": "array",
      "optional": true,
      "minItems": 0,
      "addButtonText": "添加 tag",
      "fields": [
        {
          "key": "tagKey",
          "label": {
            "zh-CN": "字段名"
          },
          "type": "select",
          "required": true,
          "optional": false,
          "sourceRuntimeField": "tagKey",
          "scenes": {
            "workflow": true,
            "editor": true,
            "infocard": true,
            "search": false
          }
        },
        {
          "key": "tagKeyOther",
          "label": {
            "zh-CN": "其他字段名（当字段名=其他时填写）"
          },
          "type": "text",
          "required": false,
          "optional": true,
          "sourceRuntimeField": "tagKeyOther",
          "scenes": {
            "workflow": true,
            "editor": true,
            "infocard": true,
            "search": false
          }
        },
        {
          "key": "tagValue",
          "label": {
            "zh-CN": "值"
          },
          "type": "text",
          "required": true,
          "optional": false,
          "sourceRuntimeField": "tagValue",
          "scenes": {
            "workflow": true,
            "editor": true,
            "infocard": true,
            "search": false
          }
        }
      ]
    },
    {
      "key": "extensions",
      "label": {
        "zh-CN": "extensions（可选：仅记录信息，不参与规则）"
      },
      "type": "array",
      "optional": true,
      "minItems": 0,
      "addButtonText": "添加扩展",
      "fields": [
        {
          "key": "extGroup",
          "label": {
            "zh-CN": "组/命名空间(extGroup)"
          },
          "type": "text",
          "required": true,
          "optional": false,
          "sourceRuntimeField": "extGroup",
          "scenes": {
            "workflow": true,
            "editor": true,
            "infocard": true,
            "search": false
          }
        },
        {
          "key": "extKey",
          "label": {
            "zh-CN": "字段名(extKey)"
          },
          "type": "text",
          "required": true,
          "optional": false,
          "sourceRuntimeField": "extKey",
          "scenes": {
            "workflow": true,
            "editor": true,
            "infocard": true,
            "search": false
          }
        },
        {
          "key": "extType",
          "label": {
            "zh-CN": "值类型"
          },
          "type": "select",
          "required": true,
          "optional": false,
          "defaultValue": "EXT_VALUE_TYPE_TEXT",
          "sourceRuntimeField": "extType",
          "scenes": {
            "workflow": true,
            "editor": true,
            "infocard": true,
            "search": false
          }
        },
        {
          "key": "extValue",
          "label": {
            "zh-CN": "值(extValue)"
          },
          "type": "text",
          "required": true,
          "optional": false,
          "sourceRuntimeField": "extValue",
          "scenes": {
            "workflow": true,
            "editor": true,
            "infocard": true,
            "search": false
          }
        }
      ]
    }
  ],
  "tags": {
    "enabled": true,
    "allowOther": true,
    "items": [
      {
        "key": "category",
        "label": {
          "zh-CN": "分类(category)"
        },
        "type": "text"
      },
      {
        "key": "level",
        "label": {
          "zh-CN": "等级(level)"
        },
        "type": "number"
      },
      {
        "key": "status",
        "label": {
          "zh-CN": "状态(status)"
        },
        "type": "text"
      },
      {
        "key": "source",
        "label": {
          "zh-CN": "来源(source)"
        },
        "type": "text"
      }
    ]
  },
  "extensions": {
    "enabled": true,
    "allowOtherNamespaces": true,
    "namespaces": []
  },
  "display": {
    "runtimeStatus": "active",
    "sourceRuntimeFile": "src/components/Rules/rendering/featureRenderRules.ts",
    "rules": [
      {
        "id": "TRP-trade-point",
        "runtimeStatus": "active",
        "match": {
          "classCode": "TRP"
        },
        "profile": "poiPoint",
        "displayTier": "poi",
        "geometry": {
          "render": "none"
        },
        "label": {
          "enabled": true,
          "source": "Name",
          "styleKey": "bubble-dark-label-14"
        },
        "specialLogic": [
          {
            "key": "tradePointCardBinding",
            "mode": "optional"
          }
        ],
        "notes": "Config rule metadata. Rendering behavior is executed by featureRenderRules.ts."
      }
    ]
  },
  "card": {
    "runtimeStatus": "active",
    "layoutId": "trade-point-card",
    "sections": [
      {
        "id": "main",
        "title": "主要信息",
        "slot": "mainRows"
      },
      {
        "id": "other",
        "title": "其他信息",
        "slot": "otherRows",
        "collapsedByDefault": true
      }
    ],
    "fields": [],
    "relations": [],
    "enhancements": [
      {
        "key": "tradePointCard",
        "componentKey": "trpTradeSection",
        "dataPath": "TradeJSON",
        "runtimeStatus": "active"
      }
    ]
  },
  "workflowBindings": [
    {
      "workflowId": "trade-point-workflow",
      "default": true,
      "runtimeStatus": "active",
      "runtimeMode": "specialComponentPrimary"
    }
  ]
}
