{
  "schemaVersion": "cairnmap.class.v1",
  "projectId": "openriamap-ria",
  "runtimeStatus": "active",
  "classCode": "PFB",
  "classKey": "platformFootprint",
  "sourceFeatureKey": "站台轮廓",
  "label": {
    "zh-CN": "站台轮廓",
    "en": "Platform Footprint"
  },
  "description": "站台轮廓 class config-primary config. Runtime facade now resolves from preset Class config.",
  "data": {
    "typeField": "Type",
    "classField": "Class",
    "worldField": "World",
    "defaultType": "Polygon",
    "defaultClass": "PFB"
  },
  "geometry": {
    "type": "Polygon",
    "sourceField": "Flrpoints",
    "axisOrder": "x,y,z",
    "required": true
  },
  "identity": {
    "idField": "ID",
    "nameField": "Name",
    "displayNameField": "Name"
  },
  "classification": {
    "kindField": "Kind",
    "skindField": "SKind",
    "skind2Field": "SKind2",
    "required": false,
    "options": []
  },
  "fields": [
    {
      "key": "ID",
      "label": {
        "zh-CN": "站台轮廓ID"
      },
      "type": "text",
      "required": true,
      "optional": false,
      "sourceRuntimeField": "ID",
      "scenes": {
        "workflow": true,
        "editor": true,
        "infocard": true,
        "search": true
      }
    },
    {
      "key": "Name",
      "label": {
        "zh-CN": "站台轮廓名"
      },
      "type": "text",
      "required": true,
      "optional": false,
      "sourceRuntimeField": "Name",
      "scenes": {
        "workflow": true,
        "editor": true,
        "infocard": true,
        "search": true
      }
    },
    {
      "key": "LineID",
      "label": {
        "zh-CN": "线路ID(LineID)"
      },
      "type": "text",
      "required": true,
      "optional": false,
      "sourceRuntimeField": "LineID",
      "scenes": {
        "workflow": true,
        "editor": true,
        "infocard": true,
        "search": false
      }
    },
    {
      "key": "elevation",
      "label": {
        "zh-CN": "高度(y)"
      },
      "type": "number",
      "required": false,
      "optional": true,
      "sourceRuntimeField": "elevation",
      "scenes": {
        "workflow": true,
        "editor": true,
        "infocard": true,
        "search": false
      }
    },
    {
      "key": "height",
      "label": {
        "zh-CN": "高度(height)"
      },
      "type": "number",
      "required": false,
      "optional": true,
      "sourceRuntimeField": "height",
      "scenes": {
        "workflow": true,
        "editor": true,
        "infocard": true,
        "search": false
      }
    }
  ],
  "groups": [],
  "tags": {
    "enabled": true,
    "allowOther": true,
    "items": [
      {
        "key": "category",
        "label": {
          "zh-CN": "分类(category)"
        },
        "type": "text"
      },
      {
        "key": "level",
        "label": {
          "zh-CN": "等级(level)"
        },
        "type": "number"
      },
      {
        "key": "status",
        "label": {
          "zh-CN": "状态(status)"
        },
        "type": "text"
      },
      {
        "key": "source",
        "label": {
          "zh-CN": "来源(source)"
        },
        "type": "text"
      }
    ]
  },
  "extensions": {
    "enabled": true,
    "allowOtherNamespaces": true,
    "namespaces": []
  },
  "display": {
    "runtimeStatus": "active",
    "sourceRuntimeFile": "src/components/Rules/rendering/featureRenderRules.ts",
    "rules": [
      {
        "id": "PFB-platform-outline",
        "runtimeStatus": "active",
        "match": {
          "classCode": "PFB"
        },
        "profile": "geometryOnlyFallback",
        "displayTier": "structure",
        "geometry": {
          "render": "polygonFillOutline"
        },
        "label": {
          "enabled": false,
          "source": "Name",
          "styleKey": "gm-outline"
        },
        "specialLogic": [
          {
            "key": "stationPlatformOutlineColorBinding",
            "mode": "optional"
          }
        ],
        "notes": "Config rule metadata. Rendering behavior is executed by featureRenderRules.ts.",
        "algorithms": [
          {
            "key": "railLineColorBinding",
            "mode": "registry"
          },
          {
            "key": "stationPlatformVisibilityBinding",
            "mode": "registry"
          },
          {
            "key": "polygonCandidateAnchor",
            "mode": "registry"
          }
        ]
      }
    ]
  },
  "card": {
    "runtimeStatus": "active",
    "layoutId": "platform-footprint-card",
    "sections": [
      {
        "id": "main",
        "title": "主要信息",
        "slot": "mainRows"
      },
      {
        "id": "other",
        "title": "其他信息",
        "slot": "otherRows",
        "collapsedByDefault": true
      }
    ],
    "fields": [],
    "relations": [],
    "enhancements": [
      {
        "key": "genericRelationLinks",
        "componentKey": "relationRows",
        "runtimeStatus": "active"
      }
    ]
  },
  "workflowBindings": [
    {
      "workflowId": "rail-platform-boundary-workflow",
      "default": true,
      "runtimeStatus": "active",
      "runtimeMode": "specialComponentPrimary"
    }
  ]
}
